{
  "schemaVersion": 2,
  "trackId": "re_n1-38_final",
  "source": {
    "file": "Re_n1-38_final.wav",
    "sha256": "f15c138b8747a72d3d4f403cd15cf762c89e3c2364e6d5618136962843699b17",
    "durationSeconds": 148.8869,
    "sampleRate": 48000
  },
  "analyzer": {
    "provider": "librosa",
    "version": "vibraxis-0.2.3/librosa-0.11.0",
    "analyzedAt": "2026-07-21T11:57:04.844508+00:00",
    "configHash": "a56de27e0f27289a6f0e3e6b2a95307149d87b540c9d55939f030bb022f6997c"
  },
  "capabilities": {
    "features": {
      "status": "complete",
      "provider": "librosa",
      "version": "vibraxis-0.2.3/librosa-0.11.0",
      "confidence": 0.8,
      "error": null
    },
    "beatGrid": {
      "status": "partial",
      "provider": "vibraxis-harmonic",
      "version": "vibraxis-0.2.3/librosa-0.11.0",
      "confidence": 0.6,
      "error": "downbeat phase from harmonic change; residual half-bar cases need a human offset"
    },
    "harmony": {
      "status": "partial",
      "provider": "vibraxis-chroma",
      "version": "vibraxis-0.2.3/librosa-0.11.0",
      "confidence": 0.45,
      "error": "chord accuracy has not passed the human ground-truth gate"
    },
    "structure": {
      "status": "partial",
      "provider": "vibraxis-heuristic",
      "version": "vibraxis-0.2.3/librosa-0.11.0",
      "confidence": 0.45,
      "error": "section accuracy has not passed the human ground-truth gate"
    }
  },
  "tempo": {
    "bpm": 192.0,
    "rawBpm": 95.339,
    "adjustment": "none",
    "timeSignature": "4/4",
    "beatsSeconds": [
      0.0146,
      0.3271,
      0.6396,
      0.9521,
      1.2646,
      1.5771,
      1.8896,
      2.2021,
      2.5146,
      2.8271,
      3.1396,
      3.4521,
      3.7646,
      4.0771,
      4.3896,
      4.7021,
      5.0146,
      5.3271,
      5.6396,
      5.9521,
      6.2646,
      6.5771,
      6.8896,
      7.2021,
      7.5146,
      7.8271,
      8.1396,
      8.4521,
      8.7646,
      9.0771,
      9.3896,
      9.7021,
      10.0146,
      10.3271,
      10.6396,
      10.9521,
      11.2646,
      11.5771,
      11.8896,
      12.2021,
      12.5146,
      12.8271,
      13.1396,
      13.4521,
      13.7646,
      14.0771,
      14.3896,
      14.7021,
      15.0146,
      15.3271,
      15.6396,
      15.9521,
      16.2646,
      16.5771,
      16.8896,
      17.2021,
      17.5146,
      17.8271,
      18.1396,
      18.4521,
      18.7646,
      19.0771,
      19.3896,
      19.7021,
      20.0146,
      20.3271,
      20.6396,
      20.9521,
      21.2646,
      21.5771,
      21.8896,
      22.2021,
      22.5146,
      22.8271,
      23.1396,
      23.4521,
      23.7646,
      24.0771,
      24.3896,
      24.7021,
      25.0146,
      25.3271,
      25.6396,
      25.9521,
      26.2646,
      26.5771,
      26.8896,
      27.2021,
      27.5146,
      27.8271,
      28.1396,
      28.4521,
      28.7646,
      29.0771,
      29.3896,
      29.7021,
      30.0146,
      30.3271,
      30.6396,
      30.9521,
      31.2646,
      31.5771,
      31.8896,
      32.2021,
      32.5146,
      32.8271,
      33.1396,
      33.4521,
      33.7646,
      34.0771,
      34.3896,
      34.7021,
      35.0146,
      35.3271,
      35.6396,
      35.9521,
      36.2646,
      36.5771,
      36.8896,
      37.2021,
      37.5146,
      37.8271,
      38.1396,
      38.4521,
      38.7646,
      39.0771,
      39.3896,
      39.7021,
      40.0146,
      40.3271,
      40.6396,
      40.9521,
      41.2646,
      41.5771,
      41.8896,
      42.2021,
      42.5146,
      42.8271,
      43.1396,
      43.4521,
      43.7646,
      44.0771,
      44.3896,
      44.7021,
      45.0146,
      45.3271,
      45.6396,
      45.9521,
      46.2646,
      46.5771,
      46.8896,
      47.2021,
      47.5146,
      47.8271,
      48.1396,
      48.4521,
      48.7646,
      49.0771,
      49.3896,
      49.7021,
      50.0146,
      50.3271,
      50.6396,
      50.9521,
      51.2646,
      51.5771,
      51.8896,
      52.2021,
      52.5146,
      52.8271,
      53.1396,
      53.4521,
      53.7646,
      54.0771,
      54.3896,
      54.7021,
      55.0146,
      55.3271,
      55.6396,
      55.9521,
      56.2646,
      56.5771,
      56.8896,
      57.2021,
      57.5146,
      57.8271,
      58.1396,
      58.4521,
      58.7646,
      59.0771,
      59.3896,
      59.7021,
      60.0146,
      60.3271,
      60.6396,
      60.9521,
      61.2646,
      61.5771,
      61.8896,
      62.2021,
      62.5146,
      62.8271,
      63.1396,
      63.4521,
      63.7646,
      64.0771,
      64.3896,
      64.7021,
      65.0146,
      65.3271,
      65.6396,
      65.9521,
      66.2646,
      66.5771,
      66.8896,
      67.2021,
      67.5146,
      67.8271,
      68.1396,
      68.4521,
      68.7646,
      69.0771,
      69.3896,
      69.7021,
      70.0146,
      70.3271,
      70.6396,
      70.9521,
      71.2646,
      71.5771,
      71.8896,
      72.2021,
      72.5146,
      72.8271,
      73.1396,
      73.4521,
      73.7646,
      74.0771,
      74.3896,
      74.7021,
      75.0146,
      75.3271,
      75.6396,
      75.9521,
      76.2646,
      76.5771,
      76.8896,
      77.2021,
      77.5146,
      77.8271,
      78.1396,
      78.4521,
      78.7646,
      79.0771,
      79.3896,
      79.7021,
      80.0146,
      80.3271,
      80.6396,
      80.9521,
      81.2646,
      81.5771,
      81.8896,
      82.2021,
      82.5146,
      82.8271,
      83.1396,
      83.4521,
      83.7646,
      84.0771,
      84.3896,
      84.7021,
      85.0146,
      85.3271,
      85.6396,
      85.9521,
      86.2646,
      86.5771,
      86.8896,
      87.2021,
      87.5146,
      87.8271,
      88.1396,
      88.4521,
      88.7646,
      89.0771,
      89.3896,
      89.7021,
      90.0146,
      90.3271,
      90.6396,
      90.9521,
      91.2646,
      91.5771,
      91.8896,
      92.2021,
      92.5146,
      92.8271,
      93.1396,
      93.4521,
      93.7646,
      94.0771,
      94.3896,
      94.7021,
      95.0146,
      95.3271,
      95.6396,
      95.9521,
      96.2646,
      96.5771,
      96.8896,
      97.2021,
      97.5146,
      97.8271,
      98.1396,
      98.4521,
      98.7646,
      99.0771,
      99.3896,
      99.7021,
      100.0146,
      100.3271,
      100.6396,
      100.9521,
      101.2646,
      101.5771,
      101.8896,
      102.2021,
      102.5146,
      102.8271,
      103.1396,
      103.4521,
      103.7646,
      104.0771,
      104.3896,
      104.7021,
      105.0146,
      105.3271,
      105.6396,
      105.9521,
      106.2646,
      106.5771,
      106.8896,
      107.2021,
      107.5146,
      107.8271,
      108.1396,
      108.4521,
      108.7646,
      109.0771,
      109.3896,
      109.7021,
      110.0146,
      110.3271,
      110.6396,
      110.9521,
      111.2646,
      111.5771,
      111.8896,
      112.2021,
      112.5146,
      112.8271,
      113.1396,
      113.4521,
      113.7646,
      114.0771,
      114.3896,
      114.7021,
      115.0146,
      115.3271,
      115.6396,
      115.9521,
      116.2646,
      116.5771,
      116.8896,
      117.2021,
      117.5146,
      117.8271,
      118.1396,
      118.4521,
      118.7646,
      119.0771,
      119.3896,
      119.7021,
      120.0146,
      120.3271,
      120.6396,
      120.9521,
      121.2646,
      121.5771,
      121.8896,
      122.2021,
      122.5146,
      122.8271,
      123.1396,
      123.4521,
      123.7646,
      124.0771,
      124.3896,
      124.7021,
      125.0146,
      125.3271,
      125.6396,
      125.9521,
      126.2646,
      126.5771,
      126.8896,
      127.2021,
      127.5146,
      127.8271,
      128.1396,
      128.4521,
      128.7646,
      129.0771,
      129.3896,
      129.7021,
      130.0146,
      130.3271,
      130.6396,
      130.9521,
      131.2646,
      131.5771,
      131.8896,
      132.2021,
      132.5146,
      132.8271,
      133.1396,
      133.4521,
      133.7646,
      134.0771,
      134.3896,
      134.7021,
      135.0146,
      135.3271,
      135.6396,
      135.9521,
      136.2646,
      136.5771,
      136.8896,
      137.2021,
      137.5146,
      137.8271,
      138.1396,
      138.4521,
      138.7646,
      139.0771,
      139.3896,
      139.7021,
      140.0146,
      140.3271,
      140.6396,
      140.9521,
      141.2646,
      141.5771,
      141.8896,
      142.2021,
      142.5146,
      142.8271,
      143.1396,
      143.4521,
      143.7646,
      144.0771,
      144.3896,
      144.7021,
      145.0146,
      145.3271,
      145.6396,
      145.9521,
      146.2646,
      146.5771,
      146.8896,
      147.2021,
      147.5146,
      147.8271,
      148.1396,
      148.4521,
      148.7646
    ],
    "downbeatsSeconds": [
      0.0146,
      1.2646,
      2.5146,
      3.7646,
      5.0146,
      6.2646,
      7.5146,
      8.7646,
      10.0146,
      11.2646,
      12.5146,
      13.7646,
      15.0146,
      16.2646,
      17.5146,
      18.7646,
      20.0146,
      21.2646,
      22.5146,
      23.7646,
      25.0146,
      26.2646,
      27.5146,
      28.7646,
      30.0146,
      31.2646,
      32.5146,
      33.7646,
      35.0146,
      36.2646,
      37.5146,
      38.7646,
      40.0146,
      41.2646,
      42.5146,
      43.7646,
      45.0146,
      46.2646,
      47.5146,
      48.7646,
      50.0146,
      51.2646,
      52.5146,
      53.7646,
      55.0146,
      56.2646,
      57.5146,
      58.7646,
      60.0146,
      61.2646,
      62.5146,
      63.7646,
      65.0146,
      66.2646,
      67.5146,
      68.7646,
      70.0146,
      71.2646,
      72.5146,
      73.7646,
      75.0146,
      76.2646,
      77.5146,
      78.7646,
      80.0146,
      81.2646,
      82.5146,
      83.7646,
      85.0146,
      86.2646,
      87.5146,
      88.7646,
      90.0146,
      91.2646,
      92.5146,